{
  "schema_version": "eco-ontology.release_manifest.v0",
  "ontology_version": "0.0.0-report-only.2026-06-22",
  "release_date": "2026-06-22",
  "owner": "ETO platform engineering",
  "contracts": {
    "semantic_event": "ecocheck.semantic_event.v2",
    "profile_gap_confirmed": "ecocheck.profile_gap_confirmed.v1",
    "release_manifest": "eco-ontology.release_manifest.v0",
    "consumer_compatibility_matrix": "eco-ontology.consumer_compatibility_matrix.v0"
  },
  "artifacts": [
    {
      "path": "schemas/semantic_event.v2.schema.json",
      "sha256": "report-only-generated",
      "description": "EcoCheck field fact event payload contract"
    },
    {
      "path": "schemas/profile_gap_confirmed.v1.schema.json",
      "sha256": "report-only-generated",
      "description": "EcoCheck company-profile gap confirmation contract"
    },
    {
      "path": "schemas/release_manifest.schema.json",
      "sha256": "report-only-generated",
      "description": "Ontology release manifest contract"
    },
    {
      "path": "schemas/consumer_compatibility_matrix.schema.json",
      "sha256": "report-only-generated",
      "description": "Consumer compatibility matrix contract"
    }
  ],
  "validation_summary": {
    "mode": "report-only",
    "red": 0,
    "yellow": 0,
    "info": 0
  },
  "consumer_snapshots": [
    {
      "repo": "EcoCheck",
      "branch": "codex/semantic-event-report-validator",
      "commit": "89c21c0db158c0764345f24e5503a5b52b9e5a4d",
      "validation_summary": {
        "mode": "report-only",
        "red": 0,
        "yellow": 0,
        "info": 0
      },
      "notes": "Local checked HEAD still has uncommitted EcoCheck P7/P9 work; semantic_event.v2 duplicate enum was fixed in ontology to unblock Ajv v6 schema compile."
    },
    {
      "repo": "eco-execution-graph",
      "branch": "codex/ontology-contract-governance",
      "commit": "d4cb66f15654acd3816f170daa05cfe51adbcedb",
      "validation_summary": {
        "mode": "report-only",
        "red": 0,
        "yellow": 0,
        "info": 0
      },
      "notes": "Graph P8 supports semantic_event.v2 and profile_gap_confirmed.v1 intake; graph schema instance drift is clean in report-only mode."
    },
    {
      "repo": "eco-semantic-knowledge-base",
      "branch": "codex/kb-report-only-contract-validation",
      "commit": "ca2312c13295f68583e9d1d3fa7f6035d99cc4d8",
      "validation_summary": {
        "mode": "report-only",
        "red": 0,
        "yellow": 0,
        "info": 2
      },
      "notes": "KB graph package manifest is formalized. KB schema remains a proposal and is not yet promoted into eco-ontology schemas."
    }
  ]
}
